{"admissionStatus":"admitted","contractPath":"schemas/fivefold-engine-admission-contract.json","contractSchemaValid":true,"contractSha256":"7001103470d95e7c906e670851a9c12898b025dae01c1922da590797e6a094fc","decisionLedgerSha256":"6d4ab925748a72865a3e7ee60ac1becb6d39380eb3f5270f6f9dc21b5e944923","evidenceFingerprint":"fa503fac81325e3b1f3fcd0766bbd46c937e6ef6fa58537e97bb8facea380b6f","evidenceId":"fivefold-engine-promotion-evidence-v1","exclusionEvidence":[{"checks":[{"actual":["fivefold_engine.macro_bracket","fivefold_engine.controller","fivefold_engine.runtime_cycle"],"checkId":"contract-remain-proposed","expected":["fivefold_engine.macro_bracket","fivefold_engine.controller","fivefold_engine.runtime_cycle"],"locator":"schemas/fivefold-engine-admission-contract.json#remainProposed","pass":true},{"actual":["fivefold_engine.physical_quantity_claim=false","fivefold_engine.pole_order","fivefold_engine.bit_semantics","fivefold_engine.canonical_states","fivefold_engine.canonical_transitions","fivefold_engine.geometry.kappa_formula","fivefold_engine.geometry.paired_mask_hamming_formula","fivefold_engine.geometry.signed_gram_matrix","fivefold_engine.geometry.canonical_path_size","fivefold_engine.guards"],"checkId":"source-inventory-verbatim","expected":["fivefold_engine.physical_quantity_claim=false","fivefold_engine.pole_order","fivefold_engine.bit_semantics","fivefold_engine.canonical_states","fivefold_engine.canonical_transitions","fivefold_engine.geometry.kappa_formula","fivefold_engine.geometry.paired_mask_hamming_formula","fivefold_engine.geometry.signed_gram_matrix","fivefold_engine.geometry.canonical_path_size","fivefold_engine.guards"],"locator":"court-admission-contract.json#eligibleForPromotionAtCrt309","pass":true}],"exclusionId":"fivefold_engine.macro_bracket/controller/runtime_cycle remain proposed","status":"PASS"},{"checks":[{"actual":true,"checkId":"crt347-win-conditions-authored-only","expected":true,"locator":"canonical/fivefold-capability-candidates/fivefold-capability-teleology-v1.json#winConditions","pass":true}],"exclusionId":"win-condition enforcement","status":"PASS"},{"checks":[{"actual":[],"checkId":"no-zodiac-signs-in-runtime-policy","expected":[],"locator":"schemas/court-runtime-policy.json","pass":true}],"exclusionId":"zodiac-to-Court runtime binding","status":"PASS"},{"checks":[{"actual":["court:advance","court:retreat","court:translocate"],"checkId":"operation-allow-list-bounded","expected":["court:advance","court:retreat","court:translocate"],"locator":"court-runtime-policy.json#operationAllowList","pass":true},{"actual":true,"checkId":"no-composite-transition-envelope","expected":true,"locator":"court-runtime-policy.json","pass":true}],"exclusionId":"concurrent Governor/Court transition envelope","status":"PASS"},{"checks":[{"actual":false,"checkId":"contract-physical-claim-false","expected":false,"locator":"schemas/fivefold-engine-admission-contract.json#effectBoundary.physicalQuantityClaim","pass":true}],"exclusionId":"electromagnetic or thermodynamic physical claims","status":"PASS"},{"checks":[{"actual":true,"checkId":"complement-map-unclaimed","expected":true,"locator":"provenance/court-admission-release.json#projectionRuling.explicitlyNotClaimed","pass":true}],"exclusionId":"active complement relation","status":"PASS"},{"checks":[{"actual":"detached_audit_only","checkId":"detached-audit-scope","expected":"detached_audit_only","locator":"qa/pentatonic-binding-audit-neo4j-validation.json#graphScope","pass":true}],"exclusionId":"active SUBSET_OF_7_35 projection","status":"PASS"},{"checks":[{"actual":35,"checkId":"proposed-class-count-unchanged","expected":35,"locator":"provenance/court-admission-release.json#proposedScope.pentatonicSetClassCount","pass":true}],"exclusionId":"bulk availability of unadmitted pentatonic classes","status":"PASS"},{"checks":[{"actual":{"admittedCount":0,"eligibleForAdmissionReviewCount":0,"itemCount":35,"proposedCount":35},"checkId":"backlog-summary-unchanged","expected":{"admittedCount":0,"eligibleForAdmissionReviewCount":0,"itemCount":35,"proposedCount":35},"locator":"provenance/pentatonic-set-class-admission-backlog.json#summary","pass":true},{"actual":false,"checkId":"bulk-promotion-not-allowed","expected":false,"locator":"provenance/pentatonic-set-class-admission-backlog.json#bulkPromotionAllowed","pass":true}],"exclusionId":"CRT-310 gate satisfaction","status":"PASS"},{"checks":[{"actual":"9cbf038c93a72719387e6a8094f5b466a79e61ce03371f5b2334fb26a480b64a","checkId":"frozen-engine-digest","expected":"9cbf038c93a72719387e6a8094f5b466a79e61ce03371f5b2334fb26a480b64a","locator":"fivefold_engine.yaml","pass":true}],"exclusionId":"frozen fivefold toolkit unchanged","status":"PASS"},{"checks":[{"actual":true,"checkId":"ledger-contains-crt-348-entry","expected":true,"locator":"provenance/DECISION_LEDGER.md","pass":true},{"actual":"6d4ab925748a72865a3e7ee60ac1becb6d39380eb3f5270f6f9dc21b5e944923","checkId":"decision-ledger-digest","expected":"6d4ab925748a72865a3e7ee60ac1becb6d39380eb3f5270f6f9dc21b5e944923","locator":"provenance/DECISION_LEDGER.md","pass":true}],"exclusionId":"decision ledger CRT-348 amendment recorded","status":"PASS"}],"generatedAt":"2026-10-13T00:00:00.000Z","generator":"scripts/build-fivefold-engine-promotion-evidence.py","generatorDigest":"45d9e903e1abc944f228e32aa8b16abef34db4dc7a0c1675704250e9a97b6743","invocation":["python3","scripts/build-fivefold-engine-promotion-evidence.py"],"itemEvidence":[{"checks":[{"actual":false,"checkId":"engine-value","expected":false,"locator":"fivefold_engine.yaml#physical_quantity_claim","pass":true},{"actual":{"const":false},"checkId":"toolkit-schema-pin","expected":{"const":false},"locator":"fivefold-engine.schema.json#/properties/fivefold_engine/properties/physical_quantity_claim","pass":true},{"actual":false,"checkId":"proposed-contract-value","expected":false,"locator":"schemas/fivefold-engine-admission-contract.json#promotedFields.physicalQuantityClaim.value","pass":true}],"itemId":"fivefold_engine.physical_quantity_claim=false","status":"PASS"},{"checks":[{"actual":[{"diagnosticQuestion":"How does force enter the pattern?","element":"Fire","function":"energy_modulation","governor":"Mars"},{"diagnosticQuestion":"Where is the flow going?","element":"Air","function":"direction_and_distribution","governor":"Jupiter"},{"diagnosticQuestion":"What enters meaningful relation?","element":"Water","function":"selective_cohesion","governor":"Venus"},{"diagnosticQuestion":"What can the flow not do?","element":"Earth","function":"constraint_and_form","governor":"Saturn"}],"checkId":"engine-replay","expected":[{"diagnosticQuestion":"How does force enter the pattern?","element":"Fire","function":"energy_modulation","governor":"Mars"},{"diagnosticQuestion":"Where is the flow going?","element":"Air","function":"direction_and_distribution","governor":"Jupiter"},{"diagnosticQuestion":"What enters meaningful relation?","element":"Water","function":"selective_cohesion","governor":"Venus"},{"diagnosticQuestion":"What can the flow not do?","element":"Earth","function":"constraint_and_form","governor":"Saturn"}],"locator":"fivefold_engine.yaml#pole_order","pass":true},{"actual":["Mars","Jupiter","Venus","Saturn"],"checkId":"runtime-policy-pole-order","expected":["Mars","Jupiter","Venus","Saturn"],"locator":"court-runtime-policy.json#poleOrder","pass":true},{"actual":true,"checkId":"runtime-enforcement","expected":true,"locator":"src/governor/court_runtime.py","pass":true},{"actual":[{"diagnosticQuestion":"How does force enter the pattern?","element":"Fire","function":"energy_modulation","governor":"Mars"},{"diagnosticQuestion":"Where is the flow going?","element":"Air","function":"direction_and_distribution","governor":"Jupiter"},{"diagnosticQuestion":"What enters meaningful relation?","element":"Water","function":"selective_cohesion","governor":"Venus"},{"diagnosticQuestion":"What can the flow not do?","element":"Earth","function":"constraint_and_form","governor":"Saturn"}],"checkId":"proposed-contract-replay","expected":[{"diagnosticQuestion":"How does force enter the pattern?","element":"Fire","function":"energy_modulation","governor":"Mars"},{"diagnosticQuestion":"Where is the flow going?","element":"Air","function":"direction_and_distribution","governor":"Jupiter"},{"diagnosticQuestion":"What enters meaningful relation?","element":"Water","function":"selective_cohesion","governor":"Venus"},{"diagnosticQuestion":"What can the flow not do?","element":"Earth","function":"constraint_and_form","governor":"Saturn"}],"locator":"schemas/fivefold-engine-admission-contract.json#promotedFields.poleOrder","pass":true}],"itemId":"fivefold_engine.pole_order","status":"PASS"},{"checks":[{"actual":{"0":"External","1":"Internal"},"checkId":"engine-bit-semantics","expected":{"0":"External","1":"Internal"},"locator":"fivefold_engine.yaml#bit_semantics","pass":true},{"actual":["0000","1000","1100","1110","1111"],"checkId":"runtime-vector-enum","expected":["0000","1000","1100","1110","1111"],"locator":"court-runtime-types.schema.json#/$defs/poleRegister/properties/vector","pass":true},{"actual":true,"checkId":"runtime-bit-derivation","expected":true,"locator":"src/governor/court_runtime.py#PoleRegister","pass":true},{"actual":"excluded","checkId":"zodiac-signs-excluded","expected":"excluded","locator":"schemas/fivefold-engine-admission-contract.json#promotedFields.bitSemantics.zodiacSignNames","pass":true},{"actual":[],"checkId":"policy-contains-no-zodiac-signs","expected":[],"locator":"schemas/court-runtime-policy.json","pass":true}],"itemId":"fivefold_engine.bit_semantics","status":"PASS"},{"checks":[{"actual":[{"internalPoles":[],"kappaCourt":{"denominator":1,"numerator":0},"stateId":"C0","vector":"0000"},{"internalPoles":["Mars"],"kappaCourt":{"denominator":4,"numerator":1},"stateId":"C1","vector":"1000"},{"internalPoles":["Mars","Jupiter"],"kappaCourt":{"denominator":2,"numerator":1},"stateId":"C2","vector":"1100"},{"internalPole